row_id,raw_lp_id,case_group,brief_uid,brief_role,chunk_id,lp_text,evidence_para_ids_joined,evidence_text,decision,edit_lp_text,merge_group_id,split_children,notes
873b57cd7fc2,rawlp_873b57cd7fc24897,24-297,24-297-respondents,respondent,24-297-respondents_C001,Abandoning the principle that students in public school do not suffer constitutionally cognizable coercion would render public education unworkable.,p2,"[p2] Petitioners fail to establish the requisite coercion. The “very limited record developed” so far, Pet.App.31a, evinces only public-school students’ exposure to ideas that clash with their parents’ religious beliefs—not instruction (much less indoctrination) on gender or sexuality. And this Court has made clear that students in public school (including elementary school) and the parents who send them there do not suffer constitutionally cognizable coercion by virtue of such exposure. Abandoning this longstanding principle would render public education unworkable. And upholding the principle does not call into question the sincerity of petitioners’ beliefs. Rather, it reflects a legal judgment rooted in First Amendment principles.",accept,,,,impact claim but judge can question it 
d064d50c641c,rawlp_d064d50c641c585a,24-297,24-297-respondents,respondent,24-297-respondents_C001,"Petitioners have not established coercion of themselves or their children, and thus a free-exercise burden, as a factual matter.",p3,"[p3] In any event, even if parents or students could theoretically establish a burden based on exposure to the storybooks, petitioners have not established coercion of themselves or their children, and thus a free-exercise burden, as a factual matter. To start, the record is devoid of evidence that students are compelled or pressured to act or believe contrary to their faith. In fact, MCPS expressly disavows use of the storybooks to that end, and nothing in the record controverts that disavowal, or indeed shows anything about how the storybooks have been or will be used in classrooms. Nor is there evidence that petitioners themselves are coerced. This Court has explained that parents cannot show compulsion or pressure to abandon their religious practice solely by virtue of their sincere belief that availing themselves (and their children) of a public benefit would conflict with their efforts to raise their children in accordance with their faith. To be sure, individuals may be burdened when the government disqualifies them from a public benefit due to their religious practice—but that is not this case. Petitioners instead assert that they are burdened because they cannot avail themselves of a public benefit while altering aspects of the benefit that they believe would impede their efforts to impart their faith to their children.",accept,,,,
781fbe610c04,rawlp_781fbe610c04ee8b,24-297,24-297-respondents,respondent,24-297-respondents_C001,There is no evidence that students are compelled or pressured to act or believe contrary to their faith.,p3,"[p3] In any event, even if parents or students could theoretically establish a burden based on exposure to the storybooks, petitioners have not established coercion of themselves or their children, and thus a free-exercise burden, as a factual matter. To start, the record is devoid of evidence that students are compelled or pressured to act or believe contrary to their faith. In fact, MCPS expressly disavows use of the storybooks to that end, and nothing in the record controverts that disavowal, or indeed shows anything about how the storybooks have been or will be used in classrooms. Nor is there evidence that petitioners themselves are coerced. This Court has explained that parents cannot show compulsion or pressure to abandon their religious practice solely by virtue of their sincere belief that availing themselves (and their children) of a public benefit would conflict with their efforts to raise their children in accordance with their faith. To be sure, individuals may be burdened when the government disqualifies them from a public benefit due to their religious practice—but that is not this case. Petitioners instead assert that they are burdened because they cannot avail themselves of a public benefit while altering aspects of the benefit that they believe would impede their efforts to impart their faith to their children.",accept,,,,
7b49b96c0100,rawlp_7b49b96c01008fb9,24-297,24-297-respondents,respondent,24-297-respondents_C001,Parents cannot show compulsion or pressure to abandon their religious practice solely by virtue of their sincere belief that availing themselves (and their children) of a public benefit would conflict with their efforts to raise their children in accordance with their faith.,p3,"[p3] In any event, even if parents or students could theoretically establish a burden based on exposure to the storybooks, petitioners have not established coercion of themselves or their children, and thus a free-exercise burden, as a factual matter. To start, the record is devoid of evidence that students are compelled or pressured to act or believe contrary to their faith. In fact, MCPS expressly disavows use of the storybooks to that end, and nothing in the record controverts that disavowal, or indeed shows anything about how the storybooks have been or will be used in classrooms. Nor is there evidence that petitioners themselves are coerced. This Court has explained that parents cannot show compulsion or pressure to abandon their religious practice solely by virtue of their sincere belief that availing themselves (and their children) of a public benefit would conflict with their efforts to raise their children in accordance with their faith. To be sure, individuals may be burdened when the government disqualifies them from a public benefit due to their religious practice—but that is not this case. Petitioners instead assert that they are burdened because they cannot avail themselves of a public benefit while altering aspects of the benefit that they believe would impede their efforts to impart their faith to their children.",accept,,,,
97cf19b38547,rawlp_97cf19b38547aa97,24-297,24-297-respondents,respondent,24-297-respondents_C001,"Petitioners’ burden theory breaks from precedent because unlike this case, Yoder and the other cases petitioners invoke each involved coercion—direct or indirect—to abandon one’s religious practice.",p4,"[p4] Petitioners’ burden theory breaks from precedent. Unlike this case, Yoder and the other cases petitioners invoke each involved coercion—direct or indirect—to abandon one’s religious practice. Indeed, this Court has already corrected the “misread[ing]” of Yoder that petitioners urge, Lyng v. Northwest Indian Cemetery Protective Association, 485 U.S. 439, 456 (1988), and Yoder itself deemed it “obvious” that the Free Exercise Clause does not license parents to withdraw their children from “discrete aspects” of a public-school curriculum, Yoder, 406 U.S. at 235. Nor does petitioners’ claim find support in history and tradition. To the contrary, since the dawn of public schools, courts have routinely approved public schools’ denial of opt-out requests, including for religious reasons.",accept,,,,
663f7ea2d75d,rawlp_663f7ea2d75d453a,24-297,24-297-respondents,respondent,24-297-respondents_C001,Yoder itself deemed it ‘obvious’ that the Free Exercise Clause does not license parents to withdraw their children from ‘discrete aspects’ of a public-school curriculum.,p4,"[p4] Petitioners’ burden theory breaks from precedent. Unlike this case, Yoder and the other cases petitioners invoke each involved coercion—direct or indirect—to abandon one’s religious practice. Indeed, this Court has already corrected the “misread[ing]” of Yoder that petitioners urge, Lyng v. Northwest Indian Cemetery Protective Association, 485 U.S. 439, 456 (1988), and Yoder itself deemed it “obvious” that the Free Exercise Clause does not license parents to withdraw their children from “discrete aspects” of a public-school curriculum, Yoder, 406 U.S. at 235. Nor does petitioners’ claim find support in history and tradition. To the contrary, since the dawn of public schools, courts have routinely approved public schools’ denial of opt-out requests, including for religious reasons.",accept,,,,
3cf4e05a6d7e,rawlp_3cf4e05a6d7e2fd0,24-297,24-297-respondents,respondent,24-297-respondents_C001,Petitioners cannot prevail on their free-exercise claim without establishing a cognizable burden.,p5,[p5] II. Petitioners cannot prevail on their free-exercise claim without establishing a cognizable burden. Petitioners’ contrary argument—that a policy’s non-neutrality or lack of general applicability independently triggers strict scrutiny—is untethered to the Constitution’s text and inverts this Court’s free-exercise doctrine.,accept,,,,
e5a6dcaefec4,rawlp_e5a6dcaefec4d05d,24-297,24-297-respondents,respondent,24-297-respondents_C001,A policy’s non-neutrality or lack of general applicability does not independently trigger strict scrutiny.,p5,[p5] II. Petitioners cannot prevail on their free-exercise claim without establishing a cognizable burden. Petitioners’ contrary argument—that a policy’s non-neutrality or lack of general applicability independently triggers strict scrutiny—is untethered to the Constitution’s text and inverts this Court’s free-exercise doctrine.,accept,,,,
90405f71638a,rawlp_90405f71638a2334,24-297,24-297-respondents,respondent,24-297-respondents_C001,"Even if the neutrality and general applicability of MCPS’s policy were relevant, this Court should not reach that issue, which was not addressed below by either court.",p6,"[p6] III. Even if the neutrality and general applicability of MCPS’s policy were relevant, this Court should not reach that issue, which was not addressed below by either court. In any event, the policy is neutral and generally applicable. It treats comparable religious and secular activity exactly the same; no opt-outs from ELA lessons using the storybooks are permitted. Nor does the record establish anti-religious animus behind the policy. MCPS determined that opt-outs were infeasible after attempting to accommodate “[m]any … opt out requests [that] were not religious in nature.” Pet.App.606a.",accept,,,,
2fbfdf6591c7,rawlp_2fbfdf6591c767ca,24-297,24-297-respondents,respondent,24-297-respondents_C001,MCPS’s policy is neutral and generally applicable.,p6,"[p6] III. Even if the neutrality and general applicability of MCPS’s policy were relevant, this Court should not reach that issue, which was not addressed below by either court. In any event, the policy is neutral and generally applicable. It treats comparable religious and secular activity exactly the same; no opt-outs from ELA lessons using the storybooks are permitted. Nor does the record establish anti-religious animus behind the policy. MCPS determined that opt-outs were infeasible after attempting to accommodate “[m]any … opt out requests [that] were not religious in nature.” Pet.App.606a.",reject,,,,a rhetorical conclusion that was unpacked later 
5eb1b8f254ae,rawlp_5eb1b8f254ae1f35,24-297,24-297-respondents,respondent,24-297-respondents_C001,"If this Court finds a cognizable burden, it should remand for the lower courts to determine in the first instance whether that burden is justified.",p7,"[p7] IV. If this Court finds a cognizable burden, it should remand for the lower courts to determine in the first instance whether that burden is justified. Petitioners sought certiorari solely to determine whether they established a cognizable free-exercise burden. In any event, MCPS’s policy is narrowly tailored to its compelling interest in providing an effective educational environment for all students and thus would satisfy strict scrutiny if it applied.",accept,,,,
0c6f307042a2,rawlp_0c6f307042a2c824,24-297,24-297-respondents,respondent,24-297-respondents_C001,MCPS’s policy is narrowly tailored to its compelling interest in providing an effective educational environment for all students.,p7,"[p7] IV. If this Court finds a cognizable burden, it should remand for the lower courts to determine in the first instance whether that burden is justified. Petitioners sought certiorari solely to determine whether they established a cognizable free-exercise burden. In any event, MCPS’s policy is narrowly tailored to its compelling interest in providing an effective educational environment for all students and thus would satisfy strict scrutiny if it applied.",accept,,,,
992cc8a5a1fc,rawlp_992cc8a5a1fc424e,24-297,24-297-respondents,respondent,24-297-respondents_C002,A cognizable burden exists.,p7,"[p7] IV. If this Court finds a cognizable burden, it should remand for the lower courts to determine in the first instance whether that burden is justified. Petitioners sought certiorari solely to determine whether they established a cognizable free-exercise burden. In any event, MCPS’s policy is narrowly tailored to its compelling interest in providing an effective educational environment for all students and thus would satisfy strict scrutiny if it applied.",reject,,,,this would either be a hallucination or a overly generalized statement
78dd8b6803a9,rawlp_78dd8b6803a99b5b,24-297,24-297-respondents,respondent,24-297-respondents_C002,"If a cognizable burden exists, the lower courts should determine in the first instance whether that burden is justified.",p7,"[p7] IV. If this Court finds a cognizable burden, it should remand for the lower courts to determine in the first instance whether that burden is justified. Petitioners sought certiorari solely to determine whether they established a cognizable free-exercise burden. In any event, MCPS’s policy is narrowly tailored to its compelling interest in providing an effective educational environment for all students and thus would satisfy strict scrutiny if it applied.",accept,,,,
97b952524ea0,rawlp_97b952524ea0f684,24-297,24-297-respondents,respondent,24-297-respondents_C002,MCPS's policy is narrowly tailored to its compelling interest in providing an effective educational environment for all students.,p7,"[p7] IV. If this Court finds a cognizable burden, it should remand for the lower courts to determine in the first instance whether that burden is justified. Petitioners sought certiorari solely to determine whether they established a cognizable free-exercise burden. In any event, MCPS’s policy is narrowly tailored to its compelling interest in providing an effective educational environment for all students and thus would satisfy strict scrutiny if it applied.",reject,,,,duplicating row 91
06c822b5c8fb,rawlp_06c822b5c8fba348,24-297,24-297-respondents,respondent,24-297-respondents_C002,MCPS's policy would satisfy strict scrutiny if it applied.,p7,"[p7] IV. If this Court finds a cognizable burden, it should remand for the lower courts to determine in the first instance whether that burden is justified. Petitioners sought certiorari solely to determine whether they established a cognizable free-exercise burden. In any event, MCPS’s policy is narrowly tailored to its compelling interest in providing an effective educational environment for all students and thus would satisfy strict scrutiny if it applied.",reject,,,,rhetorical conclusion
3122f959dd86,rawlp_3122f959dd865909,24-656|24-657,24-656-petitioners,petitioner,24-656-petitioners_C001,The First Amendment requires applying strict scrutiny to the Act’s TikTok-specific provision.,p1;p2,"[p1] I. The First Amendment requires applying strict scrutiny to the Act’s TikTok-specific provision.

[p2] The Government conceded that TikTok Inc. is an American company engaged in editorial curation for the U.S. TikTok platform. Curating content for an online platform is expressive activity, and using an algorithm to recommend content is an editorial choice. TikTok Inc. expressively associates with ByteDance Ltd. in doing so, and the Government disavowed any argument for disregarding TikTok Inc.’s legally distinct identity as an American speaker. The severe burden imposed on this protected expression by banning Petitioners from operating the U.S. platform is thus undeniable.",accept,,,,
40af10373e98,rawlp_40af10373e986485,24-656|24-657,24-656-petitioners,petitioner,24-656-petitioners_C001,"Curating content for an online platform is expressive activity, and using an algorithm to recommend content is an editorial choice.",p2,"[p2] The Government conceded that TikTok Inc. is an American company engaged in editorial curation for the U.S. TikTok platform. Curating content for an online platform is expressive activity, and using an algorithm to recommend content is an editorial choice. TikTok Inc. expressively associates with ByteDance Ltd. in doing so, and the Government disavowed any argument for disregarding TikTok Inc.’s legally distinct identity as an American speaker. The severe burden imposed on this protected expression by banning Petitioners from operating the U.S. platform is thus undeniable.",split,,,Curating content for online platform is expressive activity. ||| Using an algorithm to recommend content is an editorial choice;,"after spliting it into two, accept both"
ef188e181f99,rawlp_ef188e181f99300c,24-656|24-657,24-656-petitioners,petitioner,24-656-petitioners_C001,"TikTok Inc. expressively associates with ByteDance Ltd. in doing so, and the Government disavowed any argument for disregarding TikTok Inc.’s legally distinct identity as an American speaker.",p2,"[p2] The Government conceded that TikTok Inc. is an American company engaged in editorial curation for the U.S. TikTok platform. Curating content for an online platform is expressive activity, and using an algorithm to recommend content is an editorial choice. TikTok Inc. expressively associates with ByteDance Ltd. in doing so, and the Government disavowed any argument for disregarding TikTok Inc.’s legally distinct identity as an American speaker. The severe burden imposed on this protected expression by banning Petitioners from operating the U.S. platform is thus undeniable.",accept,,,,
1c3f3dd71f32,rawlp_1c3f3dd71f3268df,24-656|24-657,24-656-petitioners,petitioner,24-656-petitioners_C001,The Act inflicts a severe burden on protected expression by banning Petitioners from operating the U.S. platform.,p2,"[p2] The Government conceded that TikTok Inc. is an American company engaged in editorial curation for the U.S. TikTok platform. Curating content for an online platform is expressive activity, and using an algorithm to recommend content is an editorial choice. TikTok Inc. expressively associates with ByteDance Ltd. in doing so, and the Government disavowed any argument for disregarding TikTok Inc.’s legally distinct identity as an American speaker. The severe burden imposed on this protected expression by banning Petitioners from operating the U.S. platform is thus undeniable.",accept,,,,
3fce14bd3890,rawlp_3fce14bd3890f26c,24-656|24-657,24-656-petitioners,petitioner,24-656-petitioners_C001,"The Act generally covers applications based on their speech content, and then singles out TikTok for worse treatment than all other speakers.",p3,"[p3] The Act inflicts that burden for content-based and speaker-based reasons. The Act generally covers applications based on their speech content, and then singles out TikTok for worse treatment than all other speakers. Moreover, the Government admits that Congress did this based partly on fears that a foreign adversary might manipulate the mix of content on the TikTok platform to influence Americans’ views. The Government’s scattershot attempts to evade strict scrutiny are thus untenable.",accept,,,,
c32faa12971b,rawlp_c32faa12971b6ef4,24-656|24-657,24-656-petitioners,petitioner,24-656-petitioners_C001,The Government admits that Congress did this based partly on fears that a foreign adversary might manipulate the mix of content on the TikTok platform to influence Americans’ views.,p3,"[p3] The Act inflicts that burden for content-based and speaker-based reasons. The Act generally covers applications based on their speech content, and then singles out TikTok for worse treatment than all other speakers. Moreover, the Government admits that Congress did this based partly on fears that a foreign adversary might manipulate the mix of content on the TikTok platform to influence Americans’ views. The Government’s scattershot attempts to evade strict scrutiny are thus untenable.",reject,,,,pure fact statement- government admission
67c47d9ce7d5,rawlp_67c47d9ce7d5d6a9,24-656|24-657,24-656-petitioners,petitioner,24-656-petitioners_C001,The Act’s TikTok-specific provision fails any form of heightened First Amendment scrutiny.,p4,[p4] II. The Act’s TikTok-specific provision fails any form of heightened First Amendment scrutiny.,accept,,,,
3c373bc055d8,rawlp_3c373bc055d8c433,24-656|24-657,24-656-petitioners,petitioner,24-656-petitioners_C001,A speech restriction must be narrowly tailored to achieve an important interest under heightened scrutiny.,p5,"[p5] Under heightened scrutiny, a speech restriction must be narrowly tailored to achieve an important interest. The strict form of this standard is demanding, and the Act does not come close to the only three laws this Court has held satisfy it. Indeed, the Act’s flaws are so severe it would not even survive intermediate scrutiny.",reject,,,,a broad statement that has been unpacked in later propositions
fb650ecd2a11,rawlp_fb650ecd2a11fd61,24-656|24-657,24-656-petitioners,petitioner,24-656-petitioners_C001,The Act does not come close to the only three laws this Court has held satisfy heightened scrutiny.,p5,"[p5] Under heightened scrutiny, a speech restriction must be narrowly tailored to achieve an important interest. The strict form of this standard is demanding, and the Act does not come close to the only three laws this Court has held satisfy it. Indeed, the Act’s flaws are so severe it would not even survive intermediate scrutiny.",accept,,,,
8a855c73aba7,rawlp_8a855c73aba7a38b,24-656|24-657,24-656-petitioners,petitioner,24-656-petitioners_C001,The Act would not even survive intermediate scrutiny.,p5,"[p5] Under heightened scrutiny, a speech restriction must be narrowly tailored to achieve an important interest. The strict form of this standard is demanding, and the Act does not come close to the only three laws this Court has held satisfy it. Indeed, the Act’s flaws are so severe it would not even survive intermediate scrutiny.",accept,,,,
609e707f42f6,rawlp_609e707f42f68571,24-656|24-657,24-656-petitioners,petitioner,24-656-petitioners_C001,"Justifying the Act based on ‘content manipulation’ concerns is either an impermissible attempt to prohibit Americans from disseminating protected speech that may further foreign interests, or an overbroad attempt to prevent ‘covert’ foreign influence without Congress even having considered whether the traditional remedy of disclosure would be ineffective.",p6,"[p6] To begin, the interests asserted by the Government are facially defective. Justifying the Act based on “content manipulation” concerns is either (1) an impermissible attempt to prohibit Americans from disseminating protected speech that may further foreign interests, or (2) an overbroad attempt to prevent “covert” foreign influence without Congress even having considered whether the traditional remedy of disclosure would be ineffective. And justifying the Act based on “data protection” concerns does not work because (1) the Government cannot show that Congress would have passed the Act for that non-content-based reason alone; and (2) the Act is woefully underinderclusive as to data security since its scope is based on content.",split,,,Justifying the Act based on ‘content manipulation’ concerns is  an impermissible attempt to prohibit Americans from disseminating protected speech that may further foreign interests. III  An overbroad attempt to prevent ‘covert’ foreign influence without Congress. ,accept both after spliting
99e7220f21da,rawlp_99e7220f21daaef9,24-656|24-657,24-656-petitioners,petitioner,24-656-petitioners_C001,Justifying the Act based on ‘data protection’ concerns does not work because the Government cannot show that Congress would have passed the Act for that non-content-based reason alone.,p6,"[p6] To begin, the interests asserted by the Government are facially defective. Justifying the Act based on “content manipulation” concerns is either (1) an impermissible attempt to prohibit Americans from disseminating protected speech that may further foreign interests, or (2) an overbroad attempt to prevent “covert” foreign influence without Congress even having considered whether the traditional remedy of disclosure would be ineffective. And justifying the Act based on “data protection” concerns does not work because (1) the Government cannot show that Congress would have passed the Act for that non-content-based reason alone; and (2) the Act is woefully underinderclusive as to data security since its scope is based on content.",accept,,,,
