row_id,raw_lp_id,case_group,brief_uid,brief_role,chunk_id,lp_text,evidence_para_ids_joined,evidence_text,decision,edit_lp_text,merge_group_id,split_children,notes
e68fbef688f4,rawlp_e68fbef688f4cec7,23-1122,23-1122-petitioners,petitioner,23-1122-petitioners_C001,H.B. 1181's age-verification requirement is unconstitutional under a straightforward application of First Amendment principles.,p1,[p1] H.B. 1181’s age-verification requirement is unconstitutional under a straightforward application of First Amendment principles and precedent. The preliminary injunction should accordingly be restored.,reject,,,,"this is a conclusion, not a legal proposition that addresses one legal issue"
7551124d1ac1,rawlp_7551124d1ac1a3be,23-1122,23-1122-petitioners,petitioner,23-1122-petitioners_C001,A content-based burden on speech triggers strict scrutiny.,p2,"[p2] A. When speech is protected by the First Amendment, a content-based burden on that speech triggers strict scrutiny. H.B. 1181’s age-verification requirement fits squarely within that rule. The age-verification requirement is triggered by speech that Texas has deemed inappropriate for minors but that is constitutionally protected for adults. It is facially content-based, applying only to specified sexual material. And it imposes a clear burden, forcing adult users to incur severe privacy and security risks—which the statute leaves largely unaddressed—before they can access constitutionally protected speech.",accept,,,,
592909e12865,rawlp_592909e12865c9ae,23-1122,23-1122-petitioners,petitioner,23-1122-petitioners_C001,"H.B. 1181's age-verification requirement is facially content-based, applying only to specified sexual material.",p2,"[p2] A. When speech is protected by the First Amendment, a content-based burden on that speech triggers strict scrutiny. H.B. 1181’s age-verification requirement fits squarely within that rule. The age-verification requirement is triggered by speech that Texas has deemed inappropriate for minors but that is constitutionally protected for adults. It is facially content-based, applying only to specified sexual material. And it imposes a clear burden, forcing adult users to incur severe privacy and security risks—which the statute leaves largely unaddressed—before they can access constitutionally protected speech.",accept,,,,
6911a2d249fc,rawlp_6911a2d249fce030,23-1122,23-1122-petitioners,petitioner,23-1122-petitioners_C001,"The age-verification requirement imposes a clear burden on adult users, forcing them to incur severe privacy and security risks.",p2,"[p2] A. When speech is protected by the First Amendment, a content-based burden on that speech triggers strict scrutiny. H.B. 1181’s age-verification requirement fits squarely within that rule. The age-verification requirement is triggered by speech that Texas has deemed inappropriate for minors but that is constitutionally protected for adults. It is facially content-based, applying only to specified sexual material. And it imposes a clear burden, forcing adult users to incur severe privacy and security risks—which the statute leaves largely unaddressed—before they can access constitutionally protected speech.",accept,,,,
04a57fcf9f24,rawlp_04a57fcf9f24bafa,23-1122,23-1122-petitioners,petitioner,23-1122-petitioners_C001,This Court's precedent uniformly applies strict scrutiny to laws that burden adults' access to non-obscene sexual content.,p3,"[p3] Basic principles of free speech thus call for strict scrutiny. And this Court’s precedent removes all doubt. In an unbroken line of cases dating back decades, the Court has uniformly applied strict scrutiny to laws that do what H.B. 1181 does—burden adults’ access to non-obscene sexual content, which is constitutionally protected for them, while attempting to restrict minors’ access to that content. That line of cases culminated in Ashcroft, in which eight Justices applied strict scrutiny to a law materially indistinguishable from H.B. 1181.",accept,,,,
853ab69a8db3,rawlp_853ab69a8db3744c,23-1122,23-1122-petitioners,petitioner,23-1122-petitioners_C001,"Ashcroft applies strict scrutiny to laws like H.B. 1181, which burden adults' access to non-obscene sexual content.",p3,"[p3] Basic principles of free speech thus call for strict scrutiny. And this Court’s precedent removes all doubt. In an unbroken line of cases dating back decades, the Court has uniformly applied strict scrutiny to laws that do what H.B. 1181 does—burden adults’ access to non-obscene sexual content, which is constitutionally protected for them, while attempting to restrict minors’ access to that content. That line of cases culminated in Ashcroft, in which eight Justices applied strict scrutiny to a law materially indistinguishable from H.B. 1181.",edit,"Under Ashcroft, strict scrutiny applies to laws that burden adults' access to non-obscene sexual content. ",,,a contestable legal proposition based on a case precedent 
c854a3e27de4,rawlp_c854a3e27de48435,23-1122,23-1122-petitioners,petitioner,23-1122-petitioners_C001,"Lower federal courts may not disregard this Court's decisions, even if they perceive omissions in the Court's reasoning.",p4,"[p4] Without attempting to distinguish Ashcroft, the Fifth Circuit dismissed it by speculating that this Court did not really mean that strict scrutiny applies to laws like COPA and H.B. 1181. That position is as remarkable as it is mistaken. Lower federal courts may not disregard this Court’s decisions, even if they (mis)perceive “omissions” in the Court’s reasoning. Pet. App. 17a. Regardless, Ashcroft evidences no omission. The Ashcroft Court subjected COPA to strict scrutiny because that is what the First Amendment requires, as the United States recognized in defending the statute. The Court did not adopt the rational-basis review standard of Ginsberg, because that standard applies to the definition of obscenity for minors—not the imposition of burdens on adults, as this Court’s post-Ginsberg decisions in Reno, Playboy, and Sable confirm.",accept,,,,
5e626f77e3dd,rawlp_5e626f77e3ddd475,23-1122,23-1122-petitioners,petitioner,23-1122-petitioners_C001,The Ashcroft Court subjected COPA to strict scrutiny because that is what the First Amendment requires.,p4,"[p4] Without attempting to distinguish Ashcroft, the Fifth Circuit dismissed it by speculating that this Court did not really mean that strict scrutiny applies to laws like COPA and H.B. 1181. That position is as remarkable as it is mistaken. Lower federal courts may not disregard this Court’s decisions, even if they (mis)perceive “omissions” in the Court’s reasoning. Pet. App. 17a. Regardless, Ashcroft evidences no omission. The Ashcroft Court subjected COPA to strict scrutiny because that is what the First Amendment requires, as the United States recognized in defending the statute. The Court did not adopt the rational-basis review standard of Ginsberg, because that standard applies to the definition of obscenity for minors—not the imposition of burdens on adults, as this Court’s post-Ginsberg decisions in Reno, Playboy, and Sable confirm.",edit,COPA requires strict scrutiny if following Ashcroft ,,,
b5cd519c088d,rawlp_b5cd519c088d4f52,23-1122,23-1122-petitioners,petitioner,23-1122-petitioners_C001,"H.B. 1181's age-verification requirement is triply flawed: it is overinclusive, underinclusive, and not the least restrictive means of pursuing the state's interest.",p5,"[p5] B. Under the proper standard of strict scrutiny, this case is readily resolved. As the district court found and the Fifth Circuit did not refute, H.B. 1181’s age-verification requirement is triply flawed: it is",reject,,,,"can be divided into three legal propositions, which have been covered separately in other propositions generated"
4b3db3d5b3a8,rawlp_4b3db3d5b3a8fccd,23-1122,23-1122-petitioners,petitioner,23-1122-petitioners_C001,H.B. 1181's age-verification requirement is overinclusive because it restricts adults' access to speech that is not even sexual and not even arguably obscene for minors.,p6,"[p6] overinclusive, underinclusive, and not the least restrictive means of pursuing the state’s interest in protecting minors. It is overinclusive because— through its application to entire websites that have more than one-third content inappropriate for minors— it restricts adults’ access to speech that is not even sexual and not even arguably obscene for minors. It is underinclusive because it exempts search engines and social-media sites that make available to minors huge quantities of the same content that the statute restricts on petitioners’ websites. And it fails to adopt less restrictive and more effective alternatives to burdensome online age-verification, such as the content-filtering software that this Court identified in Ashcroft. Each of those defects is independently fatal; together, they underscore that H.B. 1181 is designed foremost to target disfavored speakers—whom the law brands with self-condemning “health warnings”— rather than to meet the state’s purported objective. Such speaker-based discrimination affords yet another reason why petitioners’ challenge will likely succeed.",accept,,,,
cdee549a9104,rawlp_cdee549a910419d4,23-1122,23-1122-petitioners,petitioner,23-1122-petitioners_C001,H.B. 1181's age-verification requirement is underinclusive because it exempts search engines and social-media sites that make available to minors huge quantities of the same content.,p6,"[p6] overinclusive, underinclusive, and not the least restrictive means of pursuing the state’s interest in protecting minors. It is overinclusive because— through its application to entire websites that have more than one-third content inappropriate for minors— it restricts adults’ access to speech that is not even sexual and not even arguably obscene for minors. It is underinclusive because it exempts search engines and social-media sites that make available to minors huge quantities of the same content that the statute restricts on petitioners’ websites. And it fails to adopt less restrictive and more effective alternatives to burdensome online age-verification, such as the content-filtering software that this Court identified in Ashcroft. Each of those defects is independently fatal; together, they underscore that H.B. 1181 is designed foremost to target disfavored speakers—whom the law brands with self-condemning “health warnings”— rather than to meet the state’s purported objective. Such speaker-based discrimination affords yet another reason why petitioners’ challenge will likely succeed.",accept,,,,
b07ac3f4a2a9,rawlp_b07ac3f4a2a96af3,23-1122,23-1122-petitioners,petitioner,23-1122-petitioners_C001,H.B. 1181's age-verification requirement fails to adopt less restrictive and more effective alternatives to burdensome online age-verification.,p6,"[p6] overinclusive, underinclusive, and not the least restrictive means of pursuing the state’s interest in protecting minors. It is overinclusive because— through its application to entire websites that have more than one-third content inappropriate for minors— it restricts adults’ access to speech that is not even sexual and not even arguably obscene for minors. It is underinclusive because it exempts search engines and social-media sites that make available to minors huge quantities of the same content that the statute restricts on petitioners’ websites. And it fails to adopt less restrictive and more effective alternatives to burdensome online age-verification, such as the content-filtering software that this Court identified in Ashcroft. Each of those defects is independently fatal; together, they underscore that H.B. 1181 is designed foremost to target disfavored speakers—whom the law brands with self-condemning “health warnings”— rather than to meet the state’s purported objective. Such speaker-based discrimination affords yet another reason why petitioners’ challenge will likely succeed.",accept,,,,
ef2117430b6d,rawlp_ef2117430b6d4fe6,23-1122,23-1122-petitioners,petitioner,23-1122-petitioners_C001,"Petitioners satisfy the remaining requirements for a preliminary injunction, including irreparable harm and the equities and public interest strongly favoring enjoining enforcement of the statute.",p7,"[p7] C. Petitioners satisfy the remaining requirements for a preliminary injunction. They, along with Texas adults, are irreparably harmed by the loss of their First Amendment freedoms and the prospect of crippling enforcement proceedings and unrecoverable compliance costs. Moreover, the equities and public interest strongly favor enjoining enforcement of the statute until the litigation is complete—just as was true for the comparable laws in Reno and Ashcroft.",reject,,,,two issues combined and each of the two was captured in the next two rows respectively
a8c1d357d5c6,rawlp_a8c1d357d5c6b598,23-1122,23-1122-petitioners,petitioner,23-1122-petitioners_C001,The equities and public interest strongly favor enjoining enforcement of the statute until the litigation is complete.,p7,"[p7] C. Petitioners satisfy the remaining requirements for a preliminary injunction. They, along with Texas adults, are irreparably harmed by the loss of their First Amendment freedoms and the prospect of crippling enforcement proceedings and unrecoverable compliance costs. Moreover, the equities and public interest strongly favor enjoining enforcement of the statute until the litigation is complete—just as was true for the comparable laws in Reno and Ashcroft.",accept,,,,
7e61126886ca,rawlp_7e61126886cad264,23-1122,23-1122-petitioners,petitioner,23-1122-petitioners_C002,Petitioners suffer irreparable harm from the loss of their First Amendment freedoms.,p7,"[p7] C. Petitioners satisfy the remaining requirements for a preliminary injunction. They, along with Texas adults, are irreparably harmed by the loss of their First Amendment freedoms and the prospect of crippling enforcement proceedings and unrecoverable compliance costs. Moreover, the equities and public interest strongly favor enjoining enforcement of the statute until the litigation is complete—just as was true for the comparable laws in Reno and Ashcroft.",accept,,,,
cc665d1feb7a,rawlp_cc665d1feb7ad2e9,23-1122,23-1122-petitioners,petitioner,23-1122-petitioners_C002,The equities favor enjoining enforcement of the statute until the litigation is complete.,p7,"[p7] C. Petitioners satisfy the remaining requirements for a preliminary injunction. They, along with Texas adults, are irreparably harmed by the loss of their First Amendment freedoms and the prospect of crippling enforcement proceedings and unrecoverable compliance costs. Moreover, the equities and public interest strongly favor enjoining enforcement of the statute until the litigation is complete—just as was true for the comparable laws in Reno and Ashcroft.",reject,,,,"duplicate (same proposition, phrased slightly different in  row 15 was accepted"
4c8b3c126bb3,rawlp_4c8b3c126bb30f4b,23-1122,23-1122-petitioners,petitioner,23-1122-petitioners_C002,"Petitioners, along with Texas adults, are irreparably harmed by the prospect of crippling enforcement proceedings and unrecoverable compliance costs.",p7,"[p7] C. Petitioners satisfy the remaining requirements for a preliminary injunction. They, along with Texas adults, are irreparably harmed by the loss of their First Amendment freedoms and the prospect of crippling enforcement proceedings and unrecoverable compliance costs. Moreover, the equities and public interest strongly favor enjoining enforcement of the statute until the litigation is complete—just as was true for the comparable laws in Reno and Ashcroft.",accept,,,,
15a8bdc4fc09,rawlp_15a8bdc4fc097262,23-1122,23-1122-petitioners,petitioner,23-1122-petitioners_C002,Enjoining enforcement of the statute until the litigation is complete is comparable to the treatment of similar laws in Reno and Ashcroft.,p7,"[p7] C. Petitioners satisfy the remaining requirements for a preliminary injunction. They, along with Texas adults, are irreparably harmed by the loss of their First Amendment freedoms and the prospect of crippling enforcement proceedings and unrecoverable compliance costs. Moreover, the equities and public interest strongly favor enjoining enforcement of the statute until the litigation is complete—just as was true for the comparable laws in Reno and Ashcroft.",accept,,,,precedent application
63a384923d6e,rawlp_63a384923d6e4932,23-1122,23-1122-respondents,respondent,23-1122-respondents_C001,A State may impose an age-verification requirement on websites trafficking in hardcore pornography.,p2;p4,"[p2] I. The Fifth Circuit followed Ginsberg and Sable. Where the level of constitutional scrutiny depends on the nature of the audience, Sable allows a State to put the onus on the speaker to serve as the gatekeeper. And Ginsberg—which upheld a State’s power to require brick-and-mortar retailers to prevent children from viewing obscenity—employs a rational-basis test.

[p4] Nor did Ashcroft II overrule Sable and Ginsberg. Because it is just as easy for websites to ensure that those wishing to gamble, buy alcohol, or view pornography are adults as it is for brick-and-mortar shopkeepers, Texas acted well within its police power by imposing that requirement on websites trafficking in hardcore pornography. And if Ashcroft II prevents Texas from requiring Petitioners to use the same age-verification services as comparable websites, Ashcroft II must be overruled. Reliable age verification was not on the table twenty years ago. That is not remotely true today.",accept,,,,
ff2e0ff088bc,rawlp_ff2e0ff088bcdef2,23-1122,23-1122-respondents,respondent,23-1122-respondents_C001,H.B. 1181 is not 'content based' because it asks whether the content is constitutionally protected in the first place.,p3,"[p3] Petitioners offer a bevy of counterarguments, but each misfires. H.B. 1181 is not “content based” because the question it asks is whether the content is constitutionally protected in the first place. Such threshold determinations have never been subjected to strict-scrutiny review. See, e.g., United States v. Stevens, 559 U.S. 460, 468-69 (2010). Otherwise, a State could not criminalize speech that facilitates crime without triggering strict scrutiny. And the suggestion that States cannot express disapproval of obscenity—a “valueless” category of speech, Counterman v. Colorado, 600 U.S. 66, 73 (2023)—turns the First Amendment on its head.",accept,,,,
03a357b97da7,rawlp_03a357b97da79fd7,23-1122,23-1122-respondents,respondent,23-1122-respondents_C001,Threshold determinations of constitutionally protected speech have never been subjected to strict-scrutiny review.,p3,"[p3] Petitioners offer a bevy of counterarguments, but each misfires. H.B. 1181 is not “content based” because the question it asks is whether the content is constitutionally protected in the first place. Such threshold determinations have never been subjected to strict-scrutiny review. See, e.g., United States v. Stevens, 559 U.S. 460, 468-69 (2010). Otherwise, a State could not criminalize speech that facilitates crime without triggering strict scrutiny. And the suggestion that States cannot express disapproval of obscenity—a “valueless” category of speech, Counterman v. Colorado, 600 U.S. 66, 73 (2023)—turns the First Amendment on its head.",accept,,,,
b5801799ab84,rawlp_b5801799ab846693,23-1122,23-1122-respondents,respondent,23-1122-respondents_C001,States may express disapproval of obscenity without triggering strict scrutiny.,p3,"[p3] Petitioners offer a bevy of counterarguments, but each misfires. H.B. 1181 is not “content based” because the question it asks is whether the content is constitutionally protected in the first place. Such threshold determinations have never been subjected to strict-scrutiny review. See, e.g., United States v. Stevens, 559 U.S. 460, 468-69 (2010). Otherwise, a State could not criminalize speech that facilitates crime without triggering strict scrutiny. And the suggestion that States cannot express disapproval of obscenity—a “valueless” category of speech, Counterman v. Colorado, 600 U.S. 66, 73 (2023)—turns the First Amendment on its head.",accept,,,,
446d86e304c0,rawlp_446d86e304c0347b,23-1122,23-1122-respondents,respondent,23-1122-respondents_C001,Ashcroft II does not prevent Texas from requiring websites to use the same age-verification services as comparable websites.,p4,"[p4] Nor did Ashcroft II overrule Sable and Ginsberg. Because it is just as easy for websites to ensure that those wishing to gamble, buy alcohol, or view pornography are adults as it is for brick-and-mortar shopkeepers, Texas acted well within its police power by imposing that requirement on websites trafficking in hardcore pornography. And if Ashcroft II prevents Texas from requiring Petitioners to use the same age-verification services as comparable websites, Ashcroft II must be overruled. Reliable age verification was not on the table twenty years ago. That is not remotely true today.",accept,,,,
cb72a2051acf,rawlp_cb72a2051acfc22e,23-1122,23-1122-respondents,respondent,23-1122-respondents_C001,"Reliable age verification was not on the table twenty years ago, but it is today.",p4,"[p4] Nor did Ashcroft II overrule Sable and Ginsberg. Because it is just as easy for websites to ensure that those wishing to gamble, buy alcohol, or view pornography are adults as it is for brick-and-mortar shopkeepers, Texas acted well within its police power by imposing that requirement on websites trafficking in hardcore pornography. And if Ashcroft II prevents Texas from requiring Petitioners to use the same age-verification services as comparable websites, Ashcroft II must be overruled. Reliable age verification was not on the table twenty years ago. That is not remotely true today.",accept,,,,keep - contestable factual premise for a legal proposition
f9c5cd52251c,rawlp_f9c5cd52251c55c8,23-1122,23-1122-respondents,respondent,23-1122-respondents_C001,"Even if heightened scrutiny applied, H.B. 1181 would clear even strict scrutiny.",p5,"[p5] II. Even if heightened scrutiny applied, the preliminary injunction would still fail. Any heightened standard could only be intermediate scrutiny, but H.B. 1181 would clear even strict scrutiny. Not only is Texas’s interest overwhelming, H.B. 1181 focuses on websites causing the most harm to children. And as more than two decades of failed filtering confirms, Texas cannot vindicate its interest in any other way.",reject,,,,too conclusion like and the reasoning is covered by other propositions
8dda8ed51cc5,rawlp_8dda8ed51cc59a6e,23-1122,23-1122-respondents,respondent,23-1122-respondents_C001,Texas's interest in protecting children from hardcore pornography is overwhelming.,p5,"[p5] II. Even if heightened scrutiny applied, the preliminary injunction would still fail. Any heightened standard could only be intermediate scrutiny, but H.B. 1181 would clear even strict scrutiny. Not only is Texas’s interest overwhelming, H.B. 1181 focuses on websites causing the most harm to children. And as more than two decades of failed filtering confirms, Texas cannot vindicate its interest in any other way.",accept,,,,
e1d9e8824825,rawlp_e1d9e88248251e30,23-1122,23-1122-respondents,respondent,23-1122-respondents_C001,H.B. 1181 focuses on websites causing the most harm to children.,p5,"[p5] II. Even if heightened scrutiny applied, the preliminary injunction would still fail. Any heightened standard could only be intermediate scrutiny, but H.B. 1181 would clear even strict scrutiny. Not only is Texas’s interest overwhelming, H.B. 1181 focuses on websites causing the most harm to children. And as more than two decades of failed filtering confirms, Texas cannot vindicate its interest in any other way.",accept,,,,
f9ff346c23f9,rawlp_f9ff346c23f934ef,23-1122,23-1122-respondents,respondent,23-1122-respondents_C001,Texas may focus on its most pressing concerns and need not address all aspects of the problem in one fell swoop.,p6,"[p6] Again, Petitioners’ counterarguments fail. They say that H.B. 1181 is not narrowly tailored because Texas does not regulate every website where obscenity is available. Yet Texas “may focus on [its] most pressing concerns” and “need not address all aspects of [the] problem in one fell swoop.” Williams-Yulee v. Fla. Bar, 575 U.S. 433, 449 (2015). Petitioners also urge content filtering but cannot show it is “at least as effective” as age verification. Reno, 521 U.S. at 874. To the contrary, despite widespread availability, filtering “has proven an ineffective mechanism.” J.A.207.",accept,,,,
a0c6eb443b03,rawlp_a0c6eb443b03d7c9,23-1122,23-1122-respondents,respondent,23-1122-respondents_C001,Content filtering has proven an ineffective mechanism for regulating access to hardcore pornography.,p6,"[p6] Again, Petitioners’ counterarguments fail. They say that H.B. 1181 is not narrowly tailored because Texas does not regulate every website where obscenity is available. Yet Texas “may focus on [its] most pressing concerns” and “need not address all aspects of [the] problem in one fell swoop.” Williams-Yulee v. Fla. Bar, 575 U.S. 433, 449 (2015). Petitioners also urge content filtering but cannot show it is “at least as effective” as age verification. Reno, 521 U.S. at 874. To the contrary, despite widespread availability, filtering “has proven an ineffective mechanism.” J.A.207.",accept, ,,,
