row_id,raw_lp_id,case_group,brief_uid,brief_role,chunk_id,lp_text,evidence_para_ids_joined,evidence_text,decision,edit_lp_text,merge_group_id,split_children,notes
5f21857fcdd0,rawlp_5f21857fcdd00150,24-656|24-657,24-656-petitioners,petitioner,24-656-petitioners_C001,The Act is woefully underinclusive as to data security since its scope is based on content.,p6,"[p6] To begin, the interests asserted by the Government are facially defective. Justifying the Act based on “content manipulation” concerns is either (1) an impermissible attempt to prohibit Americans from disseminating protected speech that may further foreign interests, or (2) an overbroad attempt to prevent “covert” foreign influence without Congress even having considered whether the traditional remedy of disclosure would be ineffective. And justifying the Act based on “data protection” concerns does not work because (1) the Government cannot show that Congress would have passed the Act for that non-content-based reason alone; and (2) the Act is woefully underinderclusive as to data security since its scope is based on content.",accept,,,,
654d82e32eb9,rawlp_654d82e32eb9fbdb,24-656|24-657,24-656-petitioners,petitioner,24-656-petitioners_C001,There are a host of other less-restrictive alternatives that Congress failed even to consider.,p7,"[p7] Regardless, the TikTok-specific provision is not remotely tailored to either of those interests. In addition to disclosures, there are a host of other less-restrictive alternatives that Congress failed even to consider. And the D.C. Circuit also did not hold the Government to its burden of proof, forgiving numerous holes in the evidentiary record.",reject,,,,accept a better one; duplicate
a9811671c8a9,rawlp_a9811671c8a98d88,24-656|24-657,24-656-petitioners,petitioner,24-656-petitioners_C001,"The D.C. Circuit did not hold the Government to its burden of proof, forgiving numerous holes in the evidentiary record.",p7,"[p7] Regardless, the TikTok-specific provision is not remotely tailored to either of those interests. In addition to disclosures, there are a host of other less-restrictive alternatives that Congress failed even to consider. And the D.C. Circuit also did not hold the Government to its burden of proof, forgiving numerous holes in the evidentiary record.",accept,,,,
78a815b25bd5,rawlp_78a815b25bd5b6c7,24-656|24-657,24-656-petitioners,petitioner,24-656-petitioners_C001,"There is no basis for subjecting TikTok to more than the Act’s generally-applicable process and standard, which Congress itself deemed to adequately address alleged adversary-controlled applications.",p8,"[p8] At minimum, the Government failed to justify treating TikTok worse than all other speakers. There is no basis for subjecting it to more than the Act’s generally-applicable process and standard, which Congress itself deemed to adequately address alleged adversary-controlled applications.",accept,,,,
61b3def88539,rawlp_61b3def8853952bb,24-656|24-657,24-656-petitioners,petitioner,24-656-petitioners_C002,The TikTok-specific provision is not tailored to the government's interests.,p7,"[p7] Regardless, the TikTok-specific provision is not remotely tailored to either of those interests. In addition to disclosures, there are a host of other less-restrictive alternatives that Congress failed even to consider. And the D.C. Circuit also did not hold the Government to its burden of proof, forgiving numerous holes in the evidentiary record.",accept,,,,
15d6f9f19c98,rawlp_15d6f9f19c98dfca,24-656|24-657,24-656-petitioners,petitioner,24-656-petitioners_C002,There are less-restrictive alternatives to the TikTok-specific provision that Congress failed to consider.,p7,"[p7] Regardless, the TikTok-specific provision is not remotely tailored to either of those interests. In addition to disclosures, there are a host of other less-restrictive alternatives that Congress failed even to consider. And the D.C. Circuit also did not hold the Government to its burden of proof, forgiving numerous holes in the evidentiary record.",accept,,,,
4e69b0b0e939,rawlp_4e69b0b0e9393057,24-656|24-657,24-656-petitioners,petitioner,24-656-petitioners_C002,The government failed to justify treating TikTok worse than other speakers.,p8,"[p8] At minimum, the Government failed to justify treating TikTok worse than all other speakers. There is no basis for subjecting it to more than the Act’s generally-applicable process and standard, which Congress itself deemed to adequately address alleged adversary-controlled applications.",accept,,,,
1a03a68cd1c5,rawlp_1a03a68cd1c5dbcd,24-656|24-657,24-656-petitioners,petitioner,24-656-petitioners_C002,TikTok should be subject to the same process and standard as other speakers under the Act.,p8,"[p8] At minimum, the Government failed to justify treating TikTok worse than all other speakers. There is no basis for subjecting it to more than the Act’s generally-applicable process and standard, which Congress itself deemed to adequately address alleged adversary-controlled applications.",reject,,,,"duplicate, accept a better version"
75fb2f4840d1,rawlp_75fb2f4840d12a08,24-656|24-657,24-656-petitioners,petitioner,24-656-petitioners_C002,The government did not meet its burden of proof regarding the TikTok-specific provision.,p7,"[p7] Regardless, the TikTok-specific provision is not remotely tailored to either of those interests. In addition to disclosures, there are a host of other less-restrictive alternatives that Congress failed even to consider. And the D.C. Circuit also did not hold the Government to its burden of proof, forgiving numerous holes in the evidentiary record.",reject,,,,accept a more concrete one
63468edaedf4,rawlp_63468edaedf4fd2b,24-656|24-657,24-656-petitioners,petitioner,24-656-petitioners_C002,The evidentiary record for the TikTok-specific provision contains numerous holes.,p7,"[p7] Regardless, the TikTok-specific provision is not remotely tailored to either of those interests. In addition to disclosures, there are a host of other less-restrictive alternatives that Congress failed even to consider. And the D.C. Circuit also did not hold the Government to its burden of proof, forgiving numerous holes in the evidentiary record.",reject,,,,accept a better/more concrete one
c8109abd1da5,rawlp_c8109abd1da545b5,24-656|24-657,24-657-petitioners,petitioner,24-657-petitioners_C001,The Protecting Americans from Foreign Adversary Controlled Applications Act suppresses the speech of American creators.,p1,[p1] The Protecting Americans from Foreign Adversary Controlled Applications Act violates the First Amendment because it suppresses the speech of American creators based primarily on an asserted government interest—policing the ideas Americans hear—that is anathema to our Nation’s history and tradition and irreconcilable with this Court’s precedents.,edit,The Protecting Americans from Foreign Adversary Controlled Applications Act violates the First Amendment because it suppresses the speech of American creators based primarily on an asserted government interest,,,incomplete
e4ba80984744,rawlp_e4ba8098474448c2,24-656|24-657,24-657-petitioners,petitioner,24-657-petitioners_C001,The government's data-security justification cannot sustain the Act.,p10,[p10] B. The government’s data-security justification cannot sustain the Act either.,reject,,,,too abstract
67538710c481,rawlp_67538710c481f2db,24-656|24-657,24-657-petitioners,petitioner,24-657-petitioners_C001,A generally applicable government interest cannot be used to justify a regulation targeted at media entities.,p11,"[p11] The government has never argued that the Act can be independently sustained on data-protection grounds. For good reason. The statute’s primary aim is expressive content, and a generally applicable government interest cannot be used to justify a regulation targeted at media entities. Ark. Writers’ Project, Inc. v. Ragland, 481 U.S. 221, 234 (1987); Minneapolis Star & Tribune Co. v. Minn. Comm’r of Revenue, 460 U.S. 575 (1983). Furthermore, the Act is woefully underinclusive from any data-security standpoint; it makes no sense to single out TikTok while excluding e-commerce and review platforms that raise the same concerns.",accept,,,,
a58ec1197b9a,rawlp_a58ec1197b9a878f,24-656|24-657,24-657-petitioners,petitioner,24-657-petitioners_C001,The Act is woefully underinclusive from any data-security standpoint.,p11,"[p11] The government has never argued that the Act can be independently sustained on data-protection grounds. For good reason. The statute’s primary aim is expressive content, and a generally applicable government interest cannot be used to justify a regulation targeted at media entities. Ark. Writers’ Project, Inc. v. Ragland, 481 U.S. 221, 234 (1987); Minneapolis Star & Tribune Co. v. Minn. Comm’r of Revenue, 460 U.S. 575 (1983). Furthermore, the Act is woefully underinclusive from any data-security standpoint; it makes no sense to single out TikTok while excluding e-commerce and review platforms that raise the same concerns.",accept,,,,
8b54be516e1b,rawlp_8b54be516e1b0b2c,24-656|24-657,24-657-petitioners,petitioner,24-657-petitioners_C001,The Act is not the least restrictive means of advancing the government's supposed data-security interest.,p12,"[p12] Furthermore, the Act is not the least restrictive means of advancing the government’s supposed data-security interest. In the very legislative package that included the Act, Congress banned data brokers from sharing Americans’ data with foreign adversary nations. Expanding that prohibition to social-media platforms would advance the government’s interest without suppressing petitioners’ speech. So would requiring disclosure of the potential data-collection risks—the traditional remedy when it comes to potential consumer harms. All told, there is no plausible need for the government to prevent millions of Americans from sharing ideas on TikTok simply to address the supposed data-security threat.",accept,,,,
fd8fc946948f,rawlp_fd8fc946948f2aba,24-656|24-657,24-657-petitioners,petitioner,24-657-petitioners_C001,There is no plausible need for the government to prevent millions of Americans from sharing ideas on TikTok simply to address the supposed data-security threat.,p12,"[p12] Furthermore, the Act is not the least restrictive means of advancing the government’s supposed data-security interest. In the very legislative package that included the Act, Congress banned data brokers from sharing Americans’ data with foreign adversary nations. Expanding that prohibition to social-media platforms would advance the government’s interest without suppressing petitioners’ speech. So would requiring disclosure of the potential data-collection risks—the traditional remedy when it comes to potential consumer harms. All told, there is no plausible need for the government to prevent millions of Americans from sharing ideas on TikTok simply to address the supposed data-security threat.",accept,,,,
31413a1ae4db,rawlp_31413a1ae4dbd81c,24-656|24-657,24-657-petitioners,petitioner,24-657-petitioners_C001,Social-media platforms are vital hubs in our modern age for the exchange of a vast array of ideas.,p3,"[p3] Social-media platforms are vital hubs in our modern age for the exchange of a vast array of ideas— from lighthearted fare to serious social and political commentary. Packingham v. North Carolina, 582 U.S. 98, 104 (2017). Millions of Americans therefore use TikTok to speak to, collaborate with, and listen to individuals from around the country, and indeed the world. If TikTok is banned, petitioners and other Americans will lose their ability to reach and learn from communities that are meaningful to them.",reject,,,,universally agreed fact statement 
1656c142937b,rawlp_1656c142937b5aa8,24-656|24-657,24-657-petitioners,petitioner,24-657-petitioners_C001,The Act is a direct and severe restraint on speech.,p4,"[p4] The text and structure of the Act confirm that the Act is a direct and severe restraint on speech. The statute targets TikTok based on the content and viewpoint of the material that could be expressed there. At the same time, it excludes from its sweep sites that host a different sort of content—reviews of products, businesses, or travel experiences.",reject,,,,to abstract
4bb29cf3ba43,rawlp_4bb29cf3ba43707b,24-656|24-657,24-657-petitioners,petitioner,24-657-petitioners_C001,The Act targets TikTok based on the content and viewpoint of the material that could be expressed there.,p4,"[p4] The text and structure of the Act confirm that the Act is a direct and severe restraint on speech. The statute targets TikTok based on the content and viewpoint of the material that could be expressed there. At the same time, it excludes from its sweep sites that host a different sort of content—reviews of products, businesses, or travel experiences.",accept,,,,
33abc989c4de,rawlp_33abc989c4de5c91,24-656|24-657,24-657-petitioners,petitioner,24-657-petitioners_C001,A divestiture of TikTok is impossible on the timeframe contemplated by the Act.,p5,"[p5] The Act’s provision theoretically allowing TikTok to effect a “qualified divestiture” does not alter this analysis. As the D.C. Circuit acknowledged, a divestiture of TikTok is impossible on the timeframe contemplated by the Act. And even if it were feasible, a forced divestiture would still impair petitioners’ free-speech rights by depriving them of the ability to collaborate with the publisher of their choice and to reach the global audience with which they currently engage.",accept,,,,
3a880f6ad946,rawlp_3a880f6ad946c656,24-656|24-657,24-657-petitioners,petitioner,24-657-petitioners_C001,A forced divestiture would still impair petitioners' free-speech rights.,p5,"[p5] The Act’s provision theoretically allowing TikTok to effect a “qualified divestiture” does not alter this analysis. As the D.C. Circuit acknowledged, a divestiture of TikTok is impossible on the timeframe contemplated by the Act. And even if it were feasible, a forced divestiture would still impair petitioners’ free-speech rights by depriving them of the ability to collaborate with the publisher of their choice and to reach the global audience with which they currently engage.",reject,,,,choose two more concrete ones
1296760143a1,rawlp_1296760143a1d1e4,24-656|24-657,24-657-petitioners,petitioner,24-657-petitioners_C001,The Act is not viewpoint-neutral.,p4,"[p4] The text and structure of the Act confirm that the Act is a direct and severe restraint on speech. The statute targets TikTok based on the content and viewpoint of the material that could be expressed there. At the same time, it excludes from its sweep sites that host a different sort of content—reviews of products, businesses, or travel experiences.",reject,,,,choose a better; more concrete one
b28bf562686b,rawlp_b28bf562686b593f,24-656|24-657,24-657-petitioners,petitioner,24-657-petitioners_C001,The Act's provision allowing TikTok to effect a 'qualified divestiture' does not alter the analysis.,p5,"[p5] The Act’s provision theoretically allowing TikTok to effect a “qualified divestiture” does not alter this analysis. As the D.C. Circuit acknowledged, a divestiture of TikTok is impossible on the timeframe contemplated by the Act. And even if it were feasible, a forced divestiture would still impair petitioners’ free-speech rights by depriving them of the ability to collaborate with the publisher of their choice and to reach the global audience with which they currently engage.",reject,,,,addressed in a better one already
f44a98b040f6,rawlp_f44a98b040f6c45b,24-656|24-657,24-657-petitioners,petitioner,24-657-petitioners_C001,The Act triggers demanding First Amendment scrutiny.,p2,[p2] I. The court below correctly recognized that the Act triggers demanding First Amendment scrutiny.,reject,,,,addressed in a better one already
608bcaf53ec5,rawlp_608bcaf53ec50c61,24-656|24-657,24-657-petitioners,petitioner,24-657-petitioners_C002,The Act is a direct and severe restraint on speech.,p4,"[p4] The text and structure of the Act confirm that the Act is a direct and severe restraint on speech. The statute targets TikTok based on the content and viewpoint of the material that could be expressed there. At the same time, it excludes from its sweep sites that host a different sort of content—reviews of products, businesses, or travel experiences.",reject,,,,
f098dc000d42,rawlp_f098dc000d422ed4,24-656|24-657,24-657-petitioners,petitioner,24-657-petitioners_C002,The Act targets TikTok based on the content and viewpoint of the material that could be expressed there.,p4,"[p4] The text and structure of the Act confirm that the Act is a direct and severe restraint on speech. The statute targets TikTok based on the content and viewpoint of the material that could be expressed there. At the same time, it excludes from its sweep sites that host a different sort of content—reviews of products, businesses, or travel experiences.",reject,,,,duplicate
444b126de1b0,rawlp_444b126de1b0f40f,24-656|24-657,24-657-petitioners,petitioner,24-657-petitioners_C002,"The Act excludes from its sweep sites that host a different sort of content—reviews of products, businesses, or travel experiences.",p4,"[p4] The text and structure of the Act confirm that the Act is a direct and severe restraint on speech. The statute targets TikTok based on the content and viewpoint of the material that could be expressed there. At the same time, it excludes from its sweep sites that host a different sort of content—reviews of products, businesses, or travel experiences.",accept,,,,
14b60b5c7df6,rawlp_14b60b5c7df6909d,24-656|24-657,24-657-petitioners,petitioner,24-657-petitioners_C002,A divestiture of TikTok is impossible on the timeframe contemplated by the Act.,p5,"[p5] The Act’s provision theoretically allowing TikTok to effect a “qualified divestiture” does not alter this analysis. As the D.C. Circuit acknowledged, a divestiture of TikTok is impossible on the timeframe contemplated by the Act. And even if it were feasible, a forced divestiture would still impair petitioners’ free-speech rights by depriving them of the ability to collaborate with the publisher of their choice and to reach the global audience with which they currently engage.",reject,,,,duplicate
cbcac6d1ebbd,rawlp_cbcac6d1ebbd01ea,24-656|24-657,24-657-petitioners,petitioner,24-657-petitioners_C002,A forced divestiture would still impair petitioners’ free-speech rights by depriving them of the ability to collaborate with the publisher of their choice.,p5,"[p5] The Act’s provision theoretically allowing TikTok to effect a “qualified divestiture” does not alter this analysis. As the D.C. Circuit acknowledged, a divestiture of TikTok is impossible on the timeframe contemplated by the Act. And even if it were feasible, a forced divestiture would still impair petitioners’ free-speech rights by depriving them of the ability to collaborate with the publisher of their choice and to reach the global audience with which they currently engage.",edit,A forced divestiture would still impair petitioners’ free-speech rights by depriving them of the ability to collaborate with the publisher of their choice and to reach the global audience that they currently engage with,,,
d8d04a65967a,rawlp_d8d04a65967ad44c,24-656|24-657,24-657-petitioners,petitioner,24-657-petitioners_C002,The government’s asserted interest in preventing ‘content manipulation’ is constitutionally illegitimate.,p6,"[p6] II. The court of appeals erred in holding that the Act satisfies strict scrutiny. The government’s asserted interest in preventing “content manipulation” is constitutionally illegitimate, and its supposed data-security interest does not alone justify the Act’s suppression of speech.",accept,,,,
2d39e5b3ffe0,rawlp_2d39e5b3ffe0ae37,24-656|24-657,24-657-petitioners,petitioner,24-657-petitioners_C002,The government’s supposed data-security interest does not alone justify the Act’s suppression of speech.,p6,"[p6] II. The court of appeals erred in holding that the Act satisfies strict scrutiny. The government’s asserted interest in preventing “content manipulation” is constitutionally illegitimate, and its supposed data-security interest does not alone justify the Act’s suppression of speech.",accept,,,,
f1f519b1edad,rawlp_f1f519b1edad7713,24-656|24-657,24-657-petitioners,petitioner,24-657-petitioners_C002,Congress cannot suppress speech simply because it worries that the speech might affect Americans’ thinking regarding social or political issues.,p7,"[p7] A. The “government has no power to restrict expression because of its message, its ideas, its subject matter, or its content.” Brown v. Ent. Merchs. Ass’n, 564 U.S. 786, 790-91 (2011) (quoting Ashcroft v. ACLU, 535 U.S. 564, 573 (2002)). Put another way, Congress cannot suppress speech simply because it worries that the speech might affect Americans’ thinking regarding social or political issues.",accept,,,,
6d9d3e3bba53,rawlp_6d9d3e3bba53f078,24-656|24-657,24-657-petitioners,petitioner,24-657-petitioners_C002,"The power to restrict expression because of its message, its ideas, its subject matter, or its content is unconstitutional.",p7,"[p7] A. The “government has no power to restrict expression because of its message, its ideas, its subject matter, or its content.” Brown v. Ent. Merchs. Ass’n, 564 U.S. 786, 790-91 (2011) (quoting Ashcroft v. ACLU, 535 U.S. 564, 573 (2002)). Put another way, Congress cannot suppress speech simply because it worries that the speech might affect Americans’ thinking regarding social or political issues.",accept,,,,
e4c30592ee1e,rawlp_e4c30592ee1e1cd7,24-656|24-657,24-657-petitioners,petitioner,24-657-petitioners_C002,This power-to-persuade principle applies equally even if a foreign entity plays some role in directing the speech to Americans.,p8,"[p8] History, tradition, and precedent confirm that this power-to-persuade principle applies equally even if a foreign entity plays some role in directing the speech to Americans. Our Nation has long charted a course permitting foreign speech while, at most, requiring any potential foreign influence on the speech simply to be identified. This Court’s cases likewise follow that line: When controversies have arisen, the Court has protected Americans’ right to hear foreign-influenced ideas, allowing Congress at most to require labeling of the ideas’ origin. See Meese v. Keene, 481 U.S. 465 (1987); Lamont v. Postmaster General, 381 U.S. 301 (1965). The sole exception—allowing the suppression in this country of speech extolling communist ideology during the Red Scare—was quickly rejected in the courts of history and law. Indeed, the separate view articulated by Justices Brandeis and Holmes in those cases—that “no danger flowing from speech” justifies its suppression on national security grounds “unless the incidence of the evil apprehended is so imminent that it may befall before there is opportunity for full discussion”—is now a foundational First Amendment principle. Whitney v. California, 274 U.S. 357, 377 (1927) (Brandeis, J., concurring).",accept,,,,
42f04ee2fe6d,rawlp_42f04ee2fe6d1f55,24-656|24-657,24-657-petitioners,petitioner,24-657-petitioners_C002,"Our Nation has long charted a course permitting foreign speech while, at most, requiring any potential foreign influence on the speech simply to be identified.",p8,"[p8] History, tradition, and precedent confirm that this power-to-persuade principle applies equally even if a foreign entity plays some role in directing the speech to Americans. Our Nation has long charted a course permitting foreign speech while, at most, requiring any potential foreign influence on the speech simply to be identified. This Court’s cases likewise follow that line: When controversies have arisen, the Court has protected Americans’ right to hear foreign-influenced ideas, allowing Congress at most to require labeling of the ideas’ origin. See Meese v. Keene, 481 U.S. 465 (1987); Lamont v. Postmaster General, 381 U.S. 301 (1965). The sole exception—allowing the suppression in this country of speech extolling communist ideology during the Red Scare—was quickly rejected in the courts of history and law. Indeed, the separate view articulated by Justices Brandeis and Holmes in those cases—that “no danger flowing from speech” justifies its suppression on national security grounds “unless the incidence of the evil apprehended is so imminent that it may befall before there is opportunity for full discussion”—is now a foundational First Amendment principle. Whitney v. California, 274 U.S. 357, 377 (1927) (Brandeis, J., concurring).",reject,,,,more a historical fact statement than a legal proposition
